{
  "schema_version": "1.0",
  "brand_name": "momo fit",
  "support_url": "",
  "booking_url": "",
  "crisis_help_url": "",
  "consult_line_url": "",
  "consult_form_url": "",
  "ai_enabled": true,
  "health_advisor_enabled": true,
  "ai_disclaimer_ja": "本アプリのAIは、運動・睡眠・ストレスなどウェルビーイング（心身のコンディション）の一般情報・セルフケアの参考としてお答えします。医療診断・治療指示は行いません。強い症状がある場合は医療機関へご相談ください。",
  "ai_extra_rules_ja": "",
  "gemini_model_override": "",
  "feature_share_trainer": true,
  "feature_sleep_log": true,
  "feature_pulse": true,
  "feature_gas_submit": true,
  "privacy_policy_url": "",
  "data_retention_note_ja": "会話本文は原則としてサーバーに長期保存しない方針です。コンディション等の記録は端末内を主とし、ジム設定により外部へ集約される場合があります（運用ポリシーに合わせて変更してください）。"
}
